{
  "bundle_version": "1.0",
  "run_id": "run_01JB5H0STED0EXAMP1E00000R2",
  "signing_key_id": "sixi-arena-ed25519-20261101",
  "files": [
    {
      "path": "episodes/0.record.json",
      "sha256": "sha256:8f26f4eade0d30a2a7ddf384c8ff725ac594ddf05b10ae0b0a3fe3ce4ee87c12",
      "bytes": 4096
    },
    {
      "path": "episodes/0.replay.json",
      "sha256": "sha256:452b584b778e0d613244a19f5ddf516a8679999916ac76d094921b07a8164310",
      "bytes": 4097
    },
    {
      "path": "episodes/1.record.json",
      "sha256": "sha256:df4b511c6e87f0fb7806cd5b8095448d20b3e321b4f953689660e4e5ce50a20b",
      "bytes": 4098
    },
    {
      "path": "episodes/1.replay.json",
      "sha256": "sha256:f6f710eeff12110f76e158c8f83a1481e1ab0ec1a06a203577c3cdc6ae7dbb03",
      "bytes": 4099
    },
    {
      "path": "episodes/10.record.json",
      "sha256": "sha256:e5c7c54b2141ec143d026c6bee980f7dfe8a19e8a0c2ea04cb4e8e455669dd72",
      "bytes": 4100
    },
    {
      "path": "episodes/10.replay.json",
      "sha256": "sha256:6a9c1152fc21a197f4340c0ffc730e0a79cbfb179614a9f2faacf602d3f7afd6",
      "bytes": 4101
    },
    {
      "path": "episodes/100.record.json",
      "sha256": "sha256:7cdbea54e94c25b7829545958beead322631f4ce59d42bc2729d43aada14a2ef",
      "bytes": 4102
    },
    {
      "path": "episodes/100.replay.json",
      "sha256": "sha256:74b6792664fb48d0c36ad7e6319cbed731691c9dd19f82de04c17582fed677a2",
      "bytes": 4103
    },
    {
      "path": "episodes/101.record.json",
      "sha256": "sha256:a27c359becbf3b53f9243edf24ceab9f93873c71e12947521c56ca4f5e23e0d6",
      "bytes": 4104
    },
    {
      "path": "episodes/101.replay.json",
      "sha256": "sha256:9b425171ce87c81111a8c6f51379a148289ae202ff8816c7bc4e794713221461",
      "bytes": 4105
    },
    {
      "path": "episodes/102.record.json",
      "sha256": "sha256:931ee19c2a245cc212f90490d61cea8178e8fca7851f0ed95f1eab4049431f3b",
      "bytes": 4106
    },
    {
      "path": "episodes/102.replay.json",
      "sha256": "sha256:d3dd0c28a871d232a34cd74faed352ef17ec1cc7bdcdaf3221ca8048c86b6960",
      "bytes": 4107
    },
    {
      "path": "episodes/103.record.json",
      "sha256": "sha256:e0b7ce7205ed9ad2babd5aa9c81ca98ef917afbad897346e0a60f21907039102",
      "bytes": 4108
    },
    {
      "path": "episodes/103.replay.json",
      "sha256": "sha256:8a210cdddd53debc052430be4cfc134694c086d4df6c68918a78bda5b36aa958",
      "bytes": 4109
    },
    {
      "path": "episodes/104.record.json",
      "sha256": "sha256:fb0df1ca872c52c56ad00312ba1d64273dbcb2f5d32a6eb560fd3746b6f1e155",
      "bytes": 4110
    },
    {
      "path": "episodes/104.replay.json",
      "sha256": "sha256:f0b33d3e63d0d7d149e1cef177379279e23717550f384a00f957c3bfa9431701",
      "bytes": 4111
    },
    {
      "path": "episodes/105.record.json",
      "sha256": "sha256:f27db0f60d2e3ca9b1816ed921d35188a1a596e64cec4d4ddd5c7fef2c9f9f2f",
      "bytes": 4112
    },
    {
      "path": "episodes/105.replay.json",
      "sha256": "sha256:a91fac91c10fec1eea8af214faf5cf0b2f6196eebfbeb4ff321703aedf504901",
      "bytes": 4113
    },
    {
      "path": "episodes/106.record.json",
      "sha256": "sha256:ea06abdc6019d45a9541cc13243170af51fc783590f3513dbb6d9d4cb68e3c72",
      "bytes": 4114
    },
    {
      "path": "episodes/106.replay.json",
      "sha256": "sha256:74080f2e7bcc7ffa00fd57de3754484c5b056021994578b080b44b6e0ee76f8c",
      "bytes": 4115
    },
    {
      "path": "episodes/107.record.json",
      "sha256": "sha256:1e2b6fed36a99e55f4b70aee4544dca945813a3558c23a85985507f3d5542bf8",
      "bytes": 4116
    },
    {
      "path": "episodes/107.replay.json",
      "sha256": "sha256:7a135e72a41ffe88dcc2bcb988146d9656fcee2eddf6269373422bc17549298d",
      "bytes": 4117
    },
    {
      "path": "episodes/108.record.json",
      "sha256": "sha256:08fae701a5f6bdb50297979517c8fef8adbe410269926a567906b53d765e7b59",
      "bytes": 4118
    },
    {
      "path": "episodes/108.replay.json",
      "sha256": "sha256:7d1e4193b9ca022035c02c5e18b1af4d948e6cbb636a7a829bf74a995ff021be",
      "bytes": 4119
    },
    {
      "path": "episodes/109.record.json",
      "sha256": "sha256:7ccde7a502d35d1190bc9c71ea1340397c5687c41a4949956eb0a0f25fcb5b3e",
      "bytes": 4120
    },
    {
      "path": "episodes/109.replay.json",
      "sha256": "sha256:e3361aacc794d5af03f73ab772eb68468d5e990b5a8ba51143d3b7e1f2751435",
      "bytes": 4121
    },
    {
      "path": "episodes/11.record.json",
      "sha256": "sha256:6d103cf6fd8bdd320eaba9b651141ad1a78013d1bb9d3691cfe10842ef558a8a",
      "bytes": 4122
    },
    {
      "path": "episodes/11.replay.json",
      "sha256": "sha256:0a24d7859b97d4e45fd21f04db384ac6d94937edd7043c8d191d9d9c7a928f04",
      "bytes": 4123
    },
    {
      "path": "episodes/110.record.json",
      "sha256": "sha256:b5f886c2d4d0558f4c818c6464d775d382fec1a4d44b94311f3bf636fad6a7dd",
      "bytes": 4124
    },
    {
      "path": "episodes/110.replay.json",
      "sha256": "sha256:56104345977ee22f3e2ec739a63d3a8263de9fa2c862e14e6c5dec3332b3ab3c",
      "bytes": 4125
    },
    {
      "path": "episodes/111.record.json",
      "sha256": "sha256:846d7259545c6b8053c4f7a2a260b6a5cd38164e72ae526c524caa9f9ef1da4b",
      "bytes": 4126
    },
    {
      "path": "episodes/111.replay.json",
      "sha256": "sha256:2b2b43af1d6e6f13475947ca05105b59ef6975b082f4be22cd7cee08e0f6581b",
      "bytes": 4127
    },
    {
      "path": "episodes/112.record.json",
      "sha256": "sha256:bcd4645ab968e11404274428817a546c778f867e3958b57c703a395197c03a6b",
      "bytes": 4128
    },
    {
      "path": "episodes/112.replay.json",
      "sha256": "sha256:013d073e46662a97858c8ab57eaef848ec95455d5687a61c0f3827d0063df058",
      "bytes": 4129
    },
    {
      "path": "episodes/113.record.json",
      "sha256": "sha256:3967f67050944768fcaeeb68432580e7de6f974b6deb093b80148932f108b5c8",
      "bytes": 4130
    },
    {
      "path": "episodes/113.replay.json",
      "sha256": "sha256:23ba187d33e08fa15cfdd502968c94d721787159bbec43cacd69f1fa24e349db",
      "bytes": 4131
    },
    {
      "path": "episodes/114.record.json",
      "sha256": "sha256:916dbf1fbd9d02fcca44be9c819dfa67210842c94ebd75b7ec95f8de288c5839",
      "bytes": 4132
    },
    {
      "path": "episodes/114.replay.json",
      "sha256": "sha256:da9ac7c947034a796cd3c1e75fc2fa21a865ff00d3d57c81023db93819cbdfcc",
      "bytes": 4133
    },
    {
      "path": "episodes/115.record.json",
      "sha256": "sha256:df5586e2263812d46ddad6ee29c886d33e0fda3dcae4c7b37706bb007729bd7d",
      "bytes": 4134
    },
    {
      "path": "episodes/115.replay.json",
      "sha256": "sha256:31f616fc80d55c3f1758f28360790c15a030a7a2ec77996ff44faac99abe365c",
      "bytes": 4135
    },
    {
      "path": "episodes/116.record.json",
      "sha256": "sha256:d63874cd9590891bba08de2fa7e6a8b91e18ce3572e01876ef320f223d9770ae",
      "bytes": 4136
    },
    {
      "path": "episodes/116.replay.json",
      "sha256": "sha256:557bcd273f310070e00bb01412295c4e7c2fb318550ca5cef363c7aa7a1cd369",
      "bytes": 4137
    },
    {
      "path": "episodes/117.record.json",
      "sha256": "sha256:3aaa389e0181d76a67567ca1db51cd2edc380247c02eced3f9b5efefb6c5a823",
      "bytes": 4138
    },
    {
      "path": "episodes/117.replay.json",
      "sha256": "sha256:a6607394e2b4e2fea592f903265aad8803061391cd5b3046605afdf3336b8490",
      "bytes": 4139
    },
    {
      "path": "episodes/118.record.json",
      "sha256": "sha256:fd9adbd96bbd0e6c092e13902bf30ff1d74a29aa5cc90e2e40fdb0432171f686",
      "bytes": 4140
    },
    {
      "path": "episodes/118.replay.json",
      "sha256": "sha256:e97b971417a97e110048b0f25e3f4291ab656a1d85286ceb08d765543ba85291",
      "bytes": 4141
    },
    {
      "path": "episodes/119.record.json",
      "sha256": "sha256:108ecc8f357801653afe27065188f4ff47f28e2d0da43598d7b0c6c117793da8",
      "bytes": 4142
    },
    {
      "path": "episodes/119.replay.json",
      "sha256": "sha256:c1adeaae12d389cb6d8ec2f91d2cf391db5a3950adc3864ca7da301afd057302",
      "bytes": 4143
    },
    {
      "path": "episodes/12.record.json",
      "sha256": "sha256:7392aca638a002c910edfeaa9439dbf70c3a9c8e006c17cdd012ba5efaf5c9b6",
      "bytes": 4144
    },
    {
      "path": "episodes/12.replay.json",
      "sha256": "sha256:07be0ad746676a66ff0b8fac83c4e179ea3c28840608914028afb7259612ba86",
      "bytes": 4145
    },
    {
      "path": "episodes/120.record.json",
      "sha256": "sha256:346476f2bc6c84b68571bfc322d54648f281f19563ad9c854da890bdcbe9b3d0",
      "bytes": 4146
    },
    {
      "path": "episodes/120.replay.json",
      "sha256": "sha256:9ee69d2a40aec55b72014098e2846aeff0a12721cc9a4ff6be2069091996dcf7",
      "bytes": 4147
    },
    {
      "path": "episodes/121.record.json",
      "sha256": "sha256:1f9f3c7acdda118fdd72a2af8ba36ae411e2ee8cd64a85f47b88ed127ca6e668",
      "bytes": 4148
    },
    {
      "path": "episodes/121.replay.json",
      "sha256": "sha256:8700c36c7890453b7b671fa5ee112b24a1bbec56537a4bdc25ea5a7ee9709569",
      "bytes": 4149
    },
    {
      "path": "episodes/122.record.json",
      "sha256": "sha256:d2422131157ecf9dfb78eb35c085a009e2850444e54f20278f63f8ba1ea65034",
      "bytes": 4150
    },
    {
      "path": "episodes/122.replay.json",
      "sha256": "sha256:807fa874cb7c8a3e7f062217588e249cd0b2371c2f53d8b88444772d3b866259",
      "bytes": 4151
    },
    {
      "path": "episodes/123.record.json",
      "sha256": "sha256:df9aa64523f5fa7930f14f8c6ad7504872393908b2f44cf1e2f71f0054cd63e2",
      "bytes": 4152
    },
    {
      "path": "episodes/123.replay.json",
      "sha256": "sha256:7fb35aac77e32462f4448b2c360b85794a12c03f49a97e655b9ee31ec6c1d1f4",
      "bytes": 4153
    },
    {
      "path": "episodes/124.record.json",
      "sha256": "sha256:a3e7d891fb8685598cb52a314919ff7653405e79433a0ce72bce8ceb5ea310bf",
      "bytes": 4154
    },
    {
      "path": "episodes/124.replay.json",